{  
   "InputTableName":"inc_service_provider",
   "OutputTableName":"dq_service_provider",
   "SourceDB":"INCOMING_LEGACY_ANGIE_DBO_DB",
   "TargetDB":"GOLD_LEGACY_ANGIE_DBO_DB",
   "DQHiveTableLocation":"$S3_BUCKET/data/gold/legacy/angie/dbo/full/daily/dq_service_provider",
   "TableValidation":[  
            {  
               "Check":"Duplicate",
               "keyColumns":"sp_id",
               "Action":"Reject"
            }
         ],
   "Columns":[
      {
         "Name":"sp_id",
         "Type":"INT",
         "Validations":[
            {
               "Check":"Null",
               "Action":"Reject"
            },
            {
               "Check":"DataType",
               "Action":"Reject"
            }
         ]
      },
       {
         "Name":"sp_status_id",
         "Type":"INT",
         "Validations":[
            {
               "Check":"Null",
               "Action":"Reject"
            },
            {
               "Check":"DataType",
               "Action":"Reject"
            }
         ]
      },
       {
         "Name":"company_name",
         "Type":"STRING",
         "Validations":[
            {
               "Check":"DataType",
               "Action":"Reject"
            }
         ]
      },
       {
         "Name":"entered_date",
         "Type":"TIMESTAMP",
         "Format":"yyyy-MM-dd HH:mm:ss",
		 "TimeZone":"UTC",
		 "ConvertToTimeZone":"EST", 		 
         "Validations":[
            {
               "Check":"DataType",
               "Action":"Reject"
            }
         ]
      },
       {
         "Name":"address_1",
         "Type":"STRING",
         "Validations":[
            {
               "Check":"DataType",
               "Action":"Reject"
            }
         ]
      },
       {
         "Name":"address_2",
         "Type":"STRING",
         "Validations":[
            {
               "Check":"DataType",
               "Action":"Reject"
            }
         ]
      },
       {
         "Name":"city",
         "Type":"STRING",
         "Validations":[
            {
               "Check":"DataType",
               "Action":"Reject"
            }
         ]
      },
       {
         "Name":"state",
         "Type":"STRING",
         "Validations":[
            {
               "Check":"DataType",
               "Action":"Reject"
            }
         ]
      },
       {
         "Name":"zip",
         "Type":"STRING",
         "Validations":[
            {
               "Check":"DataType",
               "Action":"Reject"
            }
         ]
      },
       {
         "Name":"business_date",
         "Type":"STRING",
         "Validations":[
            {
               "Check":"DataType",
               "Action":"Reject"
            }
         ]
      },
       {
         "Name":"contact_title",
         "Type":"STRING",
         "Validations":[
            {
               "Check":"DataType",
               "Action":"Reject"
            }
         ]
      },
       {
         "Name":"contact_first",
         "Type":"STRING",
         "Validations":[
            {
               "Check":"DataType",
               "Action":"Reject"
            }
         ]
      },
       {
         "Name":"contact_middle",
         "Type":"STRING",
         "Validations":[
            {
               "Check":"DataType",
               "Action":"Reject"
            }
         ]
      },
       {
         "Name":"contact_last",
         "Type":"STRING",
         "Validations":[
            {
               "Check":"DataType",
               "Action":"Reject"
            }
         ]
      },
       {
         "Name":"phone",
         "Type":"STRING",
         "Validations":[
            {
               "Check":"DataType",
               "Action":"Reject"
            }
         ]
      },
       {
         "Name":"phone_2",
         "Type":"STRING",
         "Validations":[
            {
               "Check":"DataType",
               "Action":"Reject"
            }
         ]
      },
       {
         "Name":"voice_star_number",
         "Type":"STRING",
         "Validations":[
            {
               "Check":"DataType",
               "Action":"Reject"
            }
         ]
      },
       {
         "Name":"fax",
         "Type":"STRING",
         "Validations":[
            {
               "Check":"DataType",
               "Action":"Reject"
            }
         ]
      },
       {
         "Name":"email",
         "Type":"STRING",
         "Validations":[
            {
               "Check":"DataType",
               "Action":"Reject"
            }
         ]
      },
       {
         "Name":"url",
         "Type":"STRING",
         "Validations":[
            {
               "Check":"DataType",
               "Action":"Reject"
            }
         ]
      },
       {
         "Name":"senior_discount",
         "Type":"STRING",
         "Validations":[
            {
               "Check":"DataType",
               "Action":"Reject"
            }
         ]
      },
       {
         "Name":"non_services",
         "Type":"STRING",
         "Validations":[
            {
               "Check":"DataType",
               "Action":"Reject"
            }
         ]
      },
       {
         "Name":"services",
         "Type":"STRING",
         "Validations":[
            {
               "Check":"DataType",
               "Action":"Reject"
            }
         ]
      },
       {
         "Name":"operating_hours",
         "Type":"STRING",
         "Validations":[
            {
               "Check":"DataType",
               "Action":"Reject"
            }
         ]
      },
       {
         "Name":"service_area",
         "Type":"STRING",
         "Validations":[
            {
               "Check":"DataType",
               "Action":"Reject"
            }
         ]
      },
       {
         "Name":"bus_desc",
         "Type":"STRING",
         "Validations":[
            {
               "Check":"DataType",
               "Action":"Reject"
            }
         ]
      },
       {
         "Name":"bbb",
         "Type":"STRING",
         "Validations":[
            {
               "Check":"DataType",
               "Action":"Reject"
            }
         ]
      },
       {
         "Name":"exclude_reason",
         "Type":"STRING",
         "Validations":[
            {
               "Check":"DataType",
               "Action":"Reject"
            }
         ]
      },
       {
         "Name":"internal_comment",
         "Type":"STRING",
         "Validations":[
            {
               "Check":"DataType",
               "Action":"Reject"
            }
         ]
      },
       {
         "Name":"emergency_service",
         "Type":"TINYINT",
         "Validations":[
            {
               "Check":"DataType",
               "Action":"Reject"
            },
            {
               "Check":"ValuesConstraint",
               "Values":"0,1"
            }
         ]
      },
       {
         "Name":"create_date",
         "Type":"TIMESTAMP",
         "Format":"yyyy-MM-dd HH:mm:ss",
         "Format":"yyyy-MM-dd HH:mm:ss",
		 "TimeZone":"UTC",		 
         "Validations":[
            {
               "Check":"Null",
               "Action":"Reject"
            },
            {
               "Check":"DataType",
               "Action":"Reject"
            }
         ]
      },
       {
         "Name":"create_by",
         "Type":"STRING",
         "Validations":[
            {
               "Check":"DataType",
               "Action":"Reject"
            }
         ]
      },
       {
         "Name":"country_code_id",
         "Type":"INT",
         "Validations":[
            {
               "Check":"DataType",
               "Action":"Reject"
            }
         ]
      },
       {
         "Name":"legal_business_name",
         "Type":"STRING",
         "Validations":[
            {
               "Check":"DataType",
               "Action":"Reject"
            }
         ]
      },
       {
         "Name":"classic_import_work_id",
         "Type":"INT",
         "Validations":[
            {
               "Check":"DataType",
               "Action":"Reject"
            }
         ]
      },
       {
         "Name":"known_invalid_email_address",
         "Type":"TINYINT",
         "Validations":[
            {
               "Check":"DataType",
               "Action":"Reject"
            },
            {
               "Check":"ValuesConstraint",
               "Values":"0,1"
            }
         ]
      },
       {
         "Name":"postal_address_status_id",
         "Type":"INT",
         "Validations":[
            {
               "Check":"DataType",
               "Action":"Reject"
            }
         ]
      },
       {
         "Name":"phone_status_id",
         "Type":"INT",
         "Validations":[
            {
               "Check":"DataType",
               "Action":"Reject"
            }
         ]
      }
    ]
}