{  
   "InputTableName":"inc_storefront_product_event",
   "OutputTableName":"dq_storefront_product_event",
   "SourceDB":"INCOMING_LEGACY_ANGIE_ANALYTICS_DBO_DB",
   "TargetDB":"GOLD_LEGACY_ANGIE_ANALYTICS_DBO_DB",
   "DQHiveTableLocation":"$S3_BUCKET/data/gold/legacy/angieanalytics/dbo/incremental/daily/dq_storefront_product_event/edh_bus_date=$EDH_BUS_DATE",
   "TableValidation":[  
      {  
         "Check":"Duplicate",
         "keyColumns":"storefront_product_event_id",
         "Action":"Reject"
      }
   ],
   "Columns":[  
      {  
         "Name":"storefront_product_event_id",
         "Type":"INT",
         "Validations":[  
            {  
               "Check":"Null",
               "Action":"Reject"
            },
            {  
               "Check":"DataType",
               "Action":"Reject"
            }
         ]
      },
	  {  
         "Name":"storefront_item_id",
         "Type":"INT",
         "Validations":[  
            {  
               "Check":"Null",
               "Action":"Reject"
            },
            {  
               "Check":"DataType",
               "Action":"Reject"
            }
         ]
      },
	  {  
         "Name":"member_id",
         "Type":"INT",
         "Validations":[  
            {  
               "Check":"Null",
               "Action":"Reject"
            },
            {  
               "Check":"DataType",
               "Action":"Reject"
            }
         ]
      },
	  {  
         "Name":"storefront_product_event_type_id",
         "Type":"INT",
         "Validations":[  
            {  
               "Check":"Null",
               "Action":"Reject"
            },
            {  
               "Check":"DataType",
               "Action":"Reject"
            }
         ]
      },
	   {  
         "Name":"expiration_date",
		 "Type":"TIMESTAMP",
		 "Format":"yyyy-MM-dd HH:mm:ss.SSSSSS",
		 "TimeZone":"UTC",
		 "ConvertToTimeZone":"EST",
         "Validations":[  
           {  
               "Check":"Null",
               "Action":"Reject"
            },
			{  
               "Check":"DataType",
               "Action":"Reject"
            }
            
         ]
      },	  
	  {  
         "Name":"campaign_id",
		 "Type":"STRING",
         "Validations":[  
             {  
               "Check":"DataType",
               "Action":"Reject"
            }
            
         ]
      },
	  {  
         "Name":"create_date",
		 "Type":"TIMESTAMP",
		 "Format":"yyyy-MM-dd HH:mm:ss.SSSSSS",
		 "TimeZone":"UTC",
		 "ConvertToTimeZone":"EST",
         "Validations":[  
           {  
               "Check":"Null",
               "Action":"Reject"
            },
			{  
               "Check":"DataType",
               "Action":"Reject"
            }
            
         ]
      },
	 
	  {  
         "Name":"create_by",
		 "Type":"STRING",
         "Validations":[  
             {  
               "Check":"Null",
               "Action":"Reject"
            },
			{  
               "Check":"DataType",
               "Action":"Reject"
            }
            
         ]
      },
		{  
         "Name":"update_date",
		 "Type":"TIMESTAMP",
		 "Format":"yyyy-MM-dd HH:mm:ss.SSSSSS",
		 "TimeZone":"UTC",
		 "ConvertToTimeZone":"EST",
         "Validations":[  
           {  
               "Check":"DataType",
               "Action":"Reject"
            }
            
         ]
      },	  
	  {  
         "Name":"update_by",
		 "Type":"STRING",
         "Validations":[  
             {  
               "Check":"DataType",
               "Action":"Reject"
            }
            
         ]
      }
	  
  ]
	  
}