{  
   "InputTableName":"inc_t_associate_permission",
   "OutputTableName":"dq_t_associate_permission",
   "SourceDB":"INCOMING_ALWEB_AL_DB",
   "TargetDB":"GOLD_ALWEB_AL_DB",
   "DQHiveTableLocation":"$S3_BUCKET/data/gold/alweb/angieslist/full/daily/dq_t_associate_permission",
   "TableValidation":[  
            {  
               "Check":"Duplicate",
               "keyColumns":"associate_permission_id",
               "Action":"Reject"
            }
         ],
   "Columns":[  
      {  
         "Name":"associate_permission_id ",
         "Type":"INT",
         "Validations":[  
            {  
               "Check":"Null",
               "Action":"Reject"
            },
            {  
               "Check":"DataType",
               "Action":"Reject"
            }
         ]
      },
      {  
         "Name":"  al_id",
         "Type":"INT",
         "Validations":[  
            {  
               "Check":"DataType",
               "Action":"Reject"
            }
         ]
      },
      {  
         "Name":"user_id",
         "Type":"INT",
         "Validations":[
            {  
               "Check":"Null",
               "Action":"Reject"
            },
            {
               "Check":"DataType",
               "Action":"Reject"
            }
         ]
      },
      {  
         "Name":"service_provider_id",
         "Type":"INT",
         "Validations":[  
            {  
               "Check":"Null",
               "Action":"Reject"
            },
            {  
               "Check":"DataType",
               "Action":"Reject"
            }
         ]
      },
      {  
         "Name":"name",
         "Type":"VARCHAR(254)",
         "Validations":[  
            {  
               "Check":"Null",
               "Action":"Reject"
            }			
         ]
      },
      {  
         "Name":"value",
         "Type":"TINYINT",
         "Validations":[  
            {  
               "Check":"Null",
               "Action":"Reject"
            },
            {  
               "Check":"DataType",
               "Action":"Reject"
            },
            {  
               "Check":"ValuesConstraint",
               "Values":"0,1"
            }			
         ]
      },	   
      {  
         "Name":"version",
         "Type":"INT",
         "Validations":[  
            {  
               "Check":"Null",
               "Action":"Reject"
            },
            {  
               "Check":"DataType",
               "Action":"Reject"
            }
         ]
      },      
      {  
         "Name":"create_date",
         "Type":"TIMESTAMP",
		 "Format":"yyyy-MM-dd HH:mm:ss.SSS",
		 "TimeZone":"UTC",
		 "ConvertToTimeZone":"EST",
         "Validations":[  
            {  
               "Check":"DataType",
               "Action":"Reject"
            }
         ]
      },
      {  
         "Name":"create_by",
         "Type":"INT",
         "Validations":[  
            {  
               "Check":"Null",
               "Action":"Reject"
            },
            {  
               "Check":"DataType",
               "Action":"Reject"
            }
         ]
      },
      {  
         "Name":"update_date",
         "Type":"TIMESTAMP",
		 "Format":"yyyy-MM-dd HH:mm:ss.SSS",
		 "TimeZone":"UTC",
		 "ConvertToTimeZone":"EST",
         "Validations":[  
            {  
               "Check":"DataType",
               "Action":"Reject"
            }
         ]
      },
      {  
         "Name":"update_by",
         "Type":"INT",
         "Validations":[  
            {  
               "Check":"Null",
               "Action":"Reject"
            },
            {  
               "Check":"DataType",
               "Action":"Reject"
            }
         ]
      }
   ]
}