{  
   "InputTableName":"inc_storefront_product_event_type",
   "OutputTableName":"dq_storefront_product_event_type",
   "SourceDB":"LEGACY_INCOMING_DB",
   "TargetDB":"LEGACY_GOLD_DB",
   "DQHiveTableLocation":"$S3_BUCKET/data/gold/$SOURCE_LEGACY/angie/full/daily/dq_storefront_product_event_type",
   "TableValidation":[  
      {  
         "Check":"Duplicate",
         "keyColumns":"storefront_product_event_type_id",
         "Action":"Reject"
      }
   ],
   "Columns":[  
      {  
         "Name":"create_by",
		 "Type":"STRING",
         "Validations":[  
             {  
               "Check":"Null",
               "Action":"Reject"
            },
			{  
               "Check":"DataType",
               "Action":"Reject"
            }
            
         ]
      },
	  {  
         "Name":"create_date",
		 "Type":"TIMPESTAMP",
		 "Format":"yyyy-MM-dd HH:mm:ss.SSSSSS",
         "Validations":[  
           {  
               "Check":"Null",
               "Action":"Reject"
            },
			{  
               "Check":"DataType",
               "Action":"Reject"
            }
            
         ]
      },
	  {  
         "Name":"storefront_product_event_type_description",
		 "Type":"STRING",
         "Validations":[  
             {  
               "Check":"Null",
               "Action":"Reject"
            },
			{  
               "Check":"DataType",
               "Action":"Reject"
            }
            
         ]
      },
	  {  
         "Name":"storefront_product_event_type_id",
         "Type":"INT",
         "Validations":[  
            {  
               "Check":"Null",
               "Action":"Reject"
            },
            {  
               "Check":"DataType",
               "Action":"Reject"
            }
         ]
      },
	  {  
         "Name":"storefront_product_event_type_name",
		 "Type":"STRING",
         "Validations":[  
             {  
               "Check":"Null",
               "Action":"Reject"
            },
			{  
               "Check":"DataType",
               "Action":"Reject"
            }
            
         ]
      },
	   {  
         "Name":"update_by",
		 "Type":"STRING",
         "Validations":[  
             {  
               "Check":"DataType",
               "Action":"Reject"
            }
            
         ]
      },
	  {  
         "Name":"update_date",
		 "Type":"TIMPESTAMP",
		 "Format":"yyyy-MM-dd HH:mm:ss.SSSSSS",
         "Validations":[  
           {  
               "Check":"DataType",
               "Action":"Reject"
            }
            
         ]
      }
  ]
	  
}