{  
   "InputTableName":"inc_postal_address",
   "OutputTableName":"dq_postal_address",
   "SourceDB":"INCOMING_LEGACY_ANGIE_DBO_DB",
   "TargetDB":"GOLD_LEGACY_ANGIE_DBO_DB",
   "DQHiveTableLocation":"$S3_BUCKET/data/gold/legacy/angie/dbo/full/daily/dq_postal_address",
   "TableValidation":[  
            {  
               "Check":"Duplicate",
               "keyColumns":"postal_address_id",
               "Action":"Reject"
            }
         ],
   "Columns":[  
      {  
         "Name":"postal_address_id",
         "Type":"INT",
         "Validations":[  
            {  
               "Check":"Null",
               "Action":"Reject"
            },
            {  
               "Check":"DataType",
               "Action":"Reject"
            }
         ]
      },
      {  
         "Name":"postal_format_id",
         "Type":"INT",
         "Validations":[  
            {  
               "Check":"Null",
               "Action":"Reject"
            },
            {  
               "Check":"DataType",
               "Action":"Reject"
            }
         ]
      },
      {  
         "Name":"address1",
         "Type":"STRING",
         "Validations":[  
            {  
               "Check":"DataType",
               "Action":"Reject"
            }
         ]
      },
      {  
         "Name":"address2",
         "Type":"STRING",
         "Validations":[
            
            {  
               "Check":"DataType",
               "Action":"Reject"
            }
         ]
       },
       {  
         "Name":"city",
         "Type":"STRING",
         "Validations":[
            {  
               "Check":"DataType",
               "Action":"Reject"
            }
         ]
       },
       {  
         "Name":"state",
         "Type":"STRING",
         "Validations":[
            {  
               "Check":"DataType",
               "Action":"Reject"
            }
         ]
       },
       {  
         "Name":"postal_code",
         "Type":"STRING",
         "Validations":[
            {  
               "Check":"DataType",
               "Action":"Reject"
            }
         ]
       },
       {  
         "Name":"country_code_id",
         "Type":"INT",
         "Validations":[
            {  
               "Check":"Null",
               "Action":"Reject"
            },
            {  
               "Check":"DataType",
               "Action":"Reject"
            }
         ]
       },
      {  
         "Name":"latitude",
         "Type":"DECIMAL(19,9)",
         "Validations":[  
            {  
               "Check":"Null",
               "Action":"Reject"
            },
            {  
               "Check":"DataType",
               "Action":"Reject"
            }
         ]
      },
      {  
         "Name":"longitude",
         "Type":"DECIMAL(19,9)",
         "Validations":[  
            {  
               "Check":"Null",
               "Action":"Reject"
            },
            {  
               "Check":"DataType",
               "Action":"Reject"
            }
         ]
      },
      {  
         "Name":"coordinate_confidence",
         "Type":"INT",
         "Validations":[  
            {  
               "Check":"Null",
               "Action":"Reject"
            },
            {  
               "Check":"DataType",
               "Action":"Reject"
            }
         ]
      },
      {  
         "Name":"process_date",
         "Type":"TIMESTAMP",
         "Format":"yyyy-MM-dd HH:mm:ss",
         "TimeZone":"UTC",
		 "ConvertToTimeZone":"EST",
         "Validations":[  
            {  
               "Check":"DataType",
               "Action":"Reject"
            }
         ]
      }
   ]
}