{  
   "InputTableName":"inc_service_provider_group_association",
   "OutputTableName":"dq_service_provider_group_association",
   "SourceDB":"LEGACY_INCOMING_DB",
   "TargetDB":"LEGACY_GOLD_DB",
   "DQHiveTableLocation":"$S3_BUCKET/data/gold/$SOURCE_LEGACY/angie/full/daily/dq_service_provider_group_association",
   "TableValidation":[  
            {  
               "Check":"Duplicate",
               "keyColumns":"service_provider_group_association_id",
               "Action":"Reject"
            }
         ],
   "Columns":[
   {
         "Name":"service_provider_group_association_id",
         "Type":"INT",
         "Validations":[
            {
               "Check":"Null",
               "Action":"Reject"
            },
            {
               "Check":"DataType",
               "Action":"Reject"
            }
         ]
      },
       {
         "Name":"service_provider_group_id",
         "Type":"INT",
         "Validations":[
            {
               "Check":"Null",
               "Action":"Reject"
            },
            {
               "Check":"DataType",
               "Action":"Reject"
            }
         ]
      },
       {
         "Name":"sp_id",
         "Type":"INT",
         "Validations":[
            {
               "Check":"Null",
               "Action":"Reject"
            },
            {
               "Check":"DataType",
               "Action":"Reject"
            }
         ]
      }
    ]
}