{  
   "InputTableName":"inc_member_primary_address",
   "OutputTableName":"dq_member_primary_address",
   "SourceDB":"INCOMING_LEGACY_ANGIE_DBO_DB",
   "TargetDB":"GOLD_LEGACY_ANGIE_DBO_DB",
   "DQHiveTableLocation":"$S3_BUCKET/data/gold/legacy/angie/dbo/full/daily/dq_member_primary_address",
   "TableValidation":[  
            {  
               "Check":"Duplicate",
               "keyColumns":"member_primary_address_id",
               "Action":"Reject"
            }
         ],
   "Columns":[  
      {  
         "Name":"member_primary_address_id",
         "Type":"INT",
         "Validations":[  
            {  
               "Check":"Null",
               "Action":"Reject"
            },
            {  
               "Check":"DataType",
               "Action":"Reject"
            }
         ]
      },
      {  
         "Name":"member_id",
         "Type":"INT",
         "Validations":[  
            {  
               "Check":"Null",
               "Action":"Reject"
            },
            {  
               "Check":"DataType",
               "Action":"Reject"
            }
         ]
      },
      {  
         "Name":"member_address_id",
         "Type":"INT",
         "Validations":[  
            {  
               "Check":"Null",
               "Action":"Reject"
            },
            {  
               "Check":"DataType",
               "Action":"Reject"
            }
         ]
      },
      {  
         "Name":"known_invalid_postal_address",
         "Type":"TIMESTAMP",
         "Format":"yyyy-MM-dd HH:mm:ss",
         "TimeZone":"UTC",
		 "ConvertToTimeZone":"EST",
         "Validations":[
            {  
               "Check":"DataType",
               "Action":"Reject"
            }
         ]
       },
      {  
         "Name":"create_date",
         "Type":"TIMESTAMP",
         "Format":"yyyy-MM-dd HH:mm:ss",
         "TimeZone":"UTC",
		 "ConvertToTimeZone":"EST",
         "Validations":[  
            {  
               "Check":"DataType",
               "Action":"Reject"
            }
         ]
      },
      {  
         "Name":"create_by",
         "Type":"STRING",
         "Validations":[]
      },
      {  
         "Name":"update_date",
         "Type":"TIMESTAMP",
         "Format":"yyyy-MM-dd HH:mm:ss",
         "TimeZone":"UTC",
		 "ConvertToTimeZone":"EST",
         "Validations":[  
            {  
               "Check":"DataType",
               "Action":"Reject"
            }
         ]
      },
      {  
         "Name":"update_by",
         "Type":"STRING",
         "Validations":[]
      }	   
   ]
}