{  
   "InputTableName":"inc_member_membership_tier",
   "OutputTableName":"dq_member_membership_tier",
   "SourceDB":"LEGACY_INCOMING_DB",
   "TargetDB":"LEGACY_GOLD_DB",
   "DQHiveTableLocation":"$S3_BUCKET/data/gold/$SOURCE_LEGACY/angie/full/daily/dq_member_membership_tier",
   "TableValidation":[  
            {  
               "Check":"Duplicate",
               "keyColumns":"member_membership_tier_id",
               "Action":"Reject"
            }
         ],
   "Columns":[  
      {  
         "Name":"member_membership_tier_id",
         "Type":"INT",
         "Validations":[  
            {  
               "Check":"Null",
               "Action":"Reject"
            },
            {  
               "Check":"DataType",
               "Action":"Reject"
            }
         ]
      },
      {  
         "Name":"member_id",
         "Type":"INT",
         "Validations":[  
            {  
               "Check":"Null",
               "Action":"Reject"
            },
            {  
               "Check":"DataType",
               "Action":"Reject"
            }
         ]
      },
      {  
         "Name":"membership_tier_id",
         "Type":"INT",
         "Validations":[  
            {  
               "Check":"Null",
               "Action":"Reject"
            },
            {  
               "Check":"DataType",
               "Action":"Reject"
            }
         ]
      },
      {  
         "Name":"original_purchase_price",
         "Type":"DECIMAL(10,2)",
         "Validations":[
         	{  
               "Check":"Null",
               "Action":"Reject"
            },
            {  
               "Check":"DataType",
               "Action":"Reject"
            }
         ]
      },
      {  
         "Name":"create_date",
         "Type":"TIMESTAMP",
         "Format":"yyyy-MM-dd HH:mm:ss.SSS",
         "Validations":[  
            {  
               "Check":"Null",
               "Action":"Reject"
            },
            {  
               "Check":"DataType",
               "Action":"Reject"
            }
         ]
      },
      {  
         "Name":"create_by",
         "Type":"STRING",
         "Validations":[  
            {  
               "Check":"Null",
               "Action":"Reject"
            }
         ]
      },
      {  
         "Name":"update_date",
         "Type":"TIMESTAMP",
         "Format":"yyyy-MM-dd HH:mm:ss.SSS",
         "Validations":[  
            {  
               "Check":"DataType",
               "Action":"Reject"
            }
         ]
      },
      {  
         "Name":"update_by",
         "Type":"STRING",
         "Validations":[]
      }	   
   ]
}