{  
   "InputTableName":"inc_member_membership_tier",
   "OutputTableName":"dq_member_membership_tier",
   "SourceDB":"INCOMING_LEGACY_ANGIE_DBO_DB",
   "TargetDB":"GOLD_LEGACY_ANGIE_DBO_DB",
   "DQHiveTableLocation":"$S3_BUCKET/data/gold/legacy/angie/dbo/full/daily/dq_member_membership_tier",
   "TableValidation":[  
            {  
               "Check":"Duplicate",
               "keyColumns":"member_membership_tier_id",
               "Action":"Reject"
            }
         ],
   "Columns":[  
      {  
         "Name":"member_membership_tier_id",
         "Type":"INT",
         "Validations":[  
            {  
               "Check":"Null",
               "Action":"Reject"
            },
            {  
               "Check":"DataType",
               "Action":"Reject"
            }
         ]
      },
      {  
         "Name":"member_id",
         "Type":"INT",
         "Validations":[  
            {  
               "Check":"Null",
               "Action":"Reject"
            },
            {  
               "Check":"DataType",
               "Action":"Reject"
            }
         ]
      },
      {  
         "Name":"membership_tier_id",
         "Type":"INT",
         "Validations":[  
            {  
               "Check":"Null",
               "Action":"Reject"
            },
            {  
               "Check":"DataType",
               "Action":"Reject"
            }
         ]
      },
      {  
         "Name":"original_purchase_price",
         "Type":"DECIMAL(10,2)",
         "Validations":[
         	{  
               "Check":"Null",
               "Action":"Reject"
            },
            {  
               "Check":"DataType",
               "Action":"Reject"
            }
         ]
      },
      {  
         "Name":"create_date",
         "Type":"TIMESTAMP",
         "Format":"yyyy-MM-dd HH:mm:ss",
         "TimeZone":"UTC",
		 "ConvertToTimeZone":"EST",
         "Validations":[  
            {  
               "Check":"Null",
               "Action":"Reject"
            },
            {  
               "Check":"DataType",
               "Action":"Reject"
            }
         ]
      },
      {  
         "Name":"create_by",
         "Type":"STRING",
         "Validations":[  
            
         ]
      },
      {  
         "Name":"update_date",
         "Type":"TIMESTAMP",
         "Format":"yyyy-MM-dd HH:mm:ss",
         "TimeZone":"UTC",
		 "ConvertToTimeZone":"EST",
         "Validations":[  
            {  
               "Check":"DataType",
               "Action":"Reject"
            }
         ]
      },
      {  
         "Name":"update_by",
         "Type":"STRING",
         "Validations":[]
      },
      {  
         "Name":"green_thunder_membership_tier_id",
         "Type":"INT",
         "Validations":[  
            {  
               "Check":"DataType",
               "Action":"Reject"
            }
         ]
      } 
   ]
}