{  
   "InputTableName":"inc_service_provider_background_check",
   "OutputTableName":"dq_service_provider_background_check",
   "SourceDB":"LEGACY_INCOMING_DB",
   "TargetDB":"LEGACY_GOLD_DB",
   "DQHiveTableLocation":"$S3_BUCKET/data/gold/$SOURCE_LEGACY/angie/full/daily/dq_service_provider_background_check",
   "TableValidation":[  
            {  
               "Check":"Duplicate",
               "keyColumns":"service_provider_background_check_id",
               "Action":"Reject"
            }
         ],
   "Columns":[
      {
         "Name":"service_provider_background_check_id",
         "Type":"INT",
         "Validations":[
            {
               "Check":"Null",
               "Action":"Reject"
            },
            {
               "Check":"DataType",
               "Action":"Reject"
            }
         ]
      },
       {
         "Name":"service_provider_id",
         "Type":"INT",
         "Validations":[
            {
               "Check":"Null",
               "Action":"Reject"
            },
            {
               "Check":"DataType",
               "Action":"Reject"
            }
         ]
      },
       {
         "Name":"first_name",
         "Type":"STRING",
         "Validations":[
            {
               "Check":"Null",
               "Action":"Reject"
            },
            {
               "Check":"DataType",
               "Action":"Reject"
            }
         ]
      },
       {
         "Name":"last_name",
         "Type":"STRING",
         "Validations":[
            {
               "Check":"Null",
               "Action":"Reject"
            },
            {
               "Check":"DataType",
               "Action":"Reject"
            }
         ]
      },
       {
         "Name":"profile_number",
         "Type":"STRING",
         "Validations":[
            {
               "Check":"Null",
               "Action":"Reject"
            },
            {
               "Check":"DataType",
               "Action":"Reject"
            }
         ]
      },
       {
         "Name":"completed_date",
         "Type":"TIMESTAMP",
         "Format":"yyyy-MM-dd HH:mm:ss",
         "Validations":[
            {
               "Check":"Null",
               "Action":"Reject"
            },
            {
               "Check":"DataType",
               "Action":"Reject"
            }
         ]
      },
       {
         "Name":"background_check_status_id",
         "Type":"INT",
         "Validations":[
            {
               "Check":"Null",
               "Action":"Reject"
            },
            {
               "Check":"DataType",
               "Action":"Reject"
            }
         ]
      },
       {
         "Name":"create_by",
         "Type":"STRING",
         "Validations":[
            {
               "Check":"Null",
               "Action":"Reject"
            },
            {
               "Check":"DataType",
               "Action":"Reject"
            }
         ]
      },
       {
         "Name":"create_date",
         "Type":"TIMESTAMP",
         "Format":"yyyy-MM-dd HH:mm:ss",
         "Validations":[
            {
               "Check":"Null",
               "Action":"Reject"
            },
            {
               "Check":"DataType",
               "Action":"Reject"
            }
         ]
      },
       {
         "Name":"update_by",
         "Type":"STRING",
         "Validations":[
            {
               "Check":"DataType",
               "Action":"Reject"
            }
         ]
      },
       {
         "Name":"update_date",
         "Type":"TIMESTAMP",
         "Format":"yyyy-MM-dd HH:mm:ss",
         "Validations":[
            {
               "Check":"DataType",
               "Action":"Reject"
            }
         ]
      },
       {
         "Name":"customer_id",
         "Type":"STRING",
         "Validations":[
            {
               "Check":"DataType",
               "Action":"Reject"
            }
         ]
      }
     ]
   }
