{  
   "InputTableName":"inc_markets",
   "OutputTableName":"dq_markets",
   "SourceDB":"LEGACY_INCOMING_DB",
   "TargetDB":"LEGACY_GOLD_DB",
   "DQHiveTableLocation":"$S3_BUCKET/data/gold/$SOURCE_LEGACY/angie/full/daily/dq_markets",
   "TableValidation":[  
      {  
         "Check":"Duplicate",
         "keyColumns":"market_id",
         "Action":"Reject"
      }
   ],
   "Columns":[  
      {  
         "Name":"market_id",
         "Type":"INT",
         "Validations":[  
            {  
               "Check":"Null",
               "Action":"Reject"
            },
            {  
               "Check":"DataType",
               "Action":"Reject"
            }
         ]
      },
		{  
         "Name":"market",
		 "Type":"STRING",
         "Validations":[  
             {  
               "Check":"Null",
               "Action":"Reject"
            },
			{  
               "Check":"DataType",
               "Action":"Reject"
            }
            
         ]
      },
	  {  
         "Name":"address1",
		 "Type":"STRING",
         "Validations":[  
             {  
               "Check":"DataType",
               "Action":"Reject"
            }
            
         ]
      },
	  {  
         "Name":"address2",
		 "Type":"STRING",
         "Validations":[  
             {  
               "Check":"DataType",
               "Action":"Reject"
            }
            
         ]
      },
	  {  
         "Name":"city",
		 "Type":"STRING",
         "Validations":[  
             {  
               "Check":"DataType",
               "Action":"Reject"
            }
            
         ]
      },
	  {  
         "Name":"state",
		 "Type":"STRING",
         "Validations":[  
             {  
               "Check":"DataType",
               "Action":"Reject"
            }
            
         ]
      },
	  {  
         "Name":"zip",
		 "Type":"STRING",
         "Validations":[  
             {  
               "Check":"DataType",
               "Action":"Reject"
            }
            
         ]
      },
	  {  
         "Name":"phone1",
		 "Type":"STRING",
         "Validations":[  
             {  
               "Check":"DataType",
               "Action":"Reject"
            }
            
         ]
      },
	  {  
         "Name":"phone2",
		 "Type":"STRING",
         "Validations":[  
             {  
               "Check":"DataType",
               "Action":"Reject"
            }
            
         ]
      },
	  {  
         "Name":"fax",
		 "Type":"STRING",
         "Validations":[  
             {  
               "Check":"DataType",
               "Action":"Reject"
            }
            
         ]
      },
	  {  
         "Name":"email",
		 "Type":"STRING",
         "Validations":[  
             {  
               "Check":"DataType",
               "Action":"Reject"
            }
            
         ]
      },
	  {  
         "Name":"email2",
		 "Type":"STRING",
         "Validations":[  
             {  
               "Check":"DataType",
               "Action":"Reject"
            }
            
         ]
      },
	  {  
         "Name":"email3",
		 "Type":"STRING",
         "Validations":[  
             {  
               "Check":"DataType",
               "Action":"Reject"
            }
            
         ]
      },
	  {  
         "Name":"current_days",
		 "Type":"INT",
         "Validations":[  
             {  
               "Check":"DataType",
               "Action":"Reject"
            }
            
         ]
      },
	  {  
         "Name":"mm_first",
		 "Type":"STRING",
         "Validations":[  
             {  
               "Check":"DataType",
               "Action":"Reject"
            }
            
         ]
      },
	  {  
         "Name":"mm_last",
		 "Type":"STRING",
         "Validations":[  
             {  
               "Check":"DataType",
               "Action":"Reject"
            }
            
         ]
      },
	  {  
         "Name":"phone3",
		 "Type":"STRING",
         "Validations":[  
             {  
               "Check":"DataType",
               "Action":"Reject"
            }
            
         ]
      },
	  {  
         "Name":"phone4",
		 "Type":"STRING",
         "Validations":[  
             {  
               "Check":"DataType",
               "Action":"Reject"
            }
            
         ]
      },
	  {  
         "Name":"phone5",
		 "Type":"STRING",
         "Validations":[  
             {  
               "Check":"DataType",
               "Action":"Reject"
            }
            
         ]
      },
	  
	  {  
         "Name":"search_flag",
		 "Type":"SMALLINT",
         "Validations":[  
             {  
               "Check":"DataType",
               "Action":"Reject"
            }
            
         ]
      },
	  {  
         "Name":"bucket",
		 "Type":"INT",
         "Validations":[  
             {  
               "Check":"DataType",
               "Action":"Reject"
            }
            
         ]
      },
	  {  
         "Name":"int_detailed_sort",
		 "Type":"SMALLINT",
         "Validations":[  
             {  
               "Check":"DataType",
               "Action":"Reject"
            }
            
         ]
      },
	  {  
         "Name":"int_display_requirement",
		 "Type":"INT",
         "Validations":[  
             {  
               "Check":"DataType",
               "Action":"Reject"
            }
            
         ]
      },
	  {  
         "Name":"market_place_email",
		 "Type":"STRING",
         "Validations":[  
             {  
               "Check":"DataType",
               "Action":"Reject"
            }
            
         ]
      },
	  {  
         "Name":"status",
		 "Type":"INT",
         "Validations":[  
             {  
               "Check":"DataType",
               "Action":"Reject"
            }
            
         ]
      },
	  {  
         "Name":"fundraiser_phone",
		 "Type":"STRING",
         "Validations":[  
             {  
               "Check":"DataType",
               "Action":"Reject"
            }
            
         ]
      },
	  {  
         "Name":"fundraiser_email",
		 "Type":"STRING",
         "Validations":[  
             {  
               "Check":"DataType",
               "Action":"Reject"
            }
            
         ]
      },
	  {  
         "Name":"new_market_check",
		 "Type":"TINYINT",
         "Validations":[  
            {  
               "Check":"DataType",
               "Action":"Reject"
            },
            {  
               "Check":"ValuesConstraint",
               "Values":"0,1"
            }
            
         ]
      },
	  
	  {  
         "Name":"market_open_date",
		 "Type":"TIMESTAMP",
		 "Format":"yyyy-MM-dd HH:mm:ss.SSSSSS",
         "Validations":[  
           {  
               "Check":"DataType",
               "Action":"Reject"
            }
            
         ]
      },
	  {  
         "Name":"charter_end_date",
		 "Type":"TIMESTAMP",
		 "Format":"yyyy-MM-dd HH:mm:ss.SSSSSS",
         "Validations":[  
            {  
               "Check":"DataType",
               "Action":"Reject"
            }
            
         ]
      },
	  {  
         "Name":"alm",
         "Type":"TINYINT",
         "Validations":[
			{  
               "Check":"Null",
               "Action":"Reject"
            },		 
            {  
               "Check":"DataType",
               "Action":"Reject"
            },
            {  
               "Check":"ValuesConstraint",
               "Values":"0,1"
            }
         ]
      },
	  
	  {  
         "Name":"toll_free_phone",
		 "Type":"STRING",
         "Validations":[  
             {  
               "Check":"DataType",
               "Action":"Reject"
            }
            
         ]
      },
	  {  
         "Name":"toll_free_fax",
		 "Type":"STRING",
         "Validations":[  
             {  
               "Check":"DataType",
               "Action":"Reject"
            }
            
         ]
      },
	  {  
         "Name":"default_radius",
		 "Type":"INT",
         "Validations":[  
             {  
               "Check":"Null",
               "Action":"Reject"
            },
			{  
               "Check":"DataType",
               "Action":"Reject"
            }
            
         ]
      },
	  
	  {  
         "Name":"country_code_id",
         "Type":"INT",
         "Validations":[
			{  
               "Check":"Null",
               "Action":"Reject"
            },		 
            {  
               "Check":"DataType",
               "Action":"Reject"
            }
         ]
      },
	  
      {  
         "Name":"market_url",
         "Type":"STRING",
         "Validations":[  
		   {  
               "Check":"Null",
               "Action":"Reject"
            },
            {  
               "Check":"DataType",
               "Action":"Reject"
            }
         ]
      },
	  {  
         "Name":"big_deal",
		 "Type":"TINYINT",
         "Validations":[  
             {  
               "Check":"Null",
               "Action":"Reject"
            },
			{  
               "Check":"DataType",
               "Action":"Reject"
            },
            {  
               "Check":"ValuesConstraint",
               "Values":"0,1"
            }
            
         ]
      }
  ]
	  
}