{
   "InputTableName":"inc_greenpoint_production_search_the_list",
   "OutputTableName":"dq_greenpoint_production_search_the_list",   
   "SourceDB":"INCOMING_SEGMENT_EVENTS_GPP_DB",
   "TargetDB":"GOLD_SEGMENT_EVENTS_GPP_DB",
   "DQHiveTableLocation":"$S3_BUCKET/data/gold/segment/events/greenpoint_production/incremental/daily/dq_greenpoint_production_search_the_list/edh_bus_date=$EDHBUSDATE",
   "TableValidation":[  
            {  
               "Check":"Duplicate",
               "keyColumns":"id",
               "Action":"Reject"
            }
         ],
   "Columns":[  
      {
         "Name":"id",
         "Type":"VARCHAR(254)",
         "Validations":[
		   {
               "Check":"Null",
               "Action":"Reject"
           },
            {
               "Check":"DataType",
               "Action":"Reject"
            }
         ]
      },
      {
         "Name":"received_at",
         "Type":"TIMESTAMP",
         "Format":"yyyy-MM-dd HH:mm:ss.SSS",
		 "TimeZone":"UTC",
		 "ConvertToTimeZone":"EST",
         "Validations":[
            {
               "Check":"DataType",
               "Action":"Reject"
            }
         ]
      },
      {
         "Name":"uuid",
         "Type":"BIGINT",
         "Validations":[
            {
               "Check":"DataType",
               "Action":"Reject"
            }
         ]
      },
      {
         "Name":"anonymous_id",
         "Type":"VARCHAR(256)",
         "Validations":[
            {
               "Check":"DataType",
               "Action":"Reject"
            }
         ]
      },
      {
         "Name":"context_app_build",
         "Type":"VARCHAR(256)",
         "Validations":[
            {
               "Check":"DataType",
               "Action":"Reject"
            }
         ]
      },
      {
         "Name":"context_app_name",
         "Type":"VARCHAR(256)",
         "Validations":[
            {
               "Check":"DataType",
               "Action":"Reject"
            }
         ]
      },
      {
         "Name":"context_app_version",
         "Type":"VARCHAR(256)",
         "Validations":[
            {
               "Check":"DataType",
               "Action":"Reject"
            }
         ]
      },
      {
         "Name":"context_device_ad_tracking_enabled",
         "Type":"BOOLEAN",
         "Validations":[
            {
               "Check":"DataType",
               "Action":"Reject"
            },
            {
            	"Check":"ValuesConstraint",
	            "Values":"true,false"
            }
         ]
      },
      {
         "Name":"context_device_idfa",
         "Type":"VARCHAR(256)",
         "Validations":[
            {
               "Check":"DataType",
               "Action":"Reject"
            }
         ]
      },
      {
         "Name":"context_device_idfv",
         "Type":"VARCHAR(256)",
         "Validations":[
            {
               "Check":"DataType",
               "Action":"Reject"
            }
         ]
      },
      {
         "Name":"context_device_manufacturer",
         "Type":"VARCHAR(256)",
         "Validations":[
            {
               "Check":"DataType",
               "Action":"Reject"
            }
         ]
      },
      {
         "Name":"context_device_model",
         "Type":"VARCHAR(256)",
         "Validations":[
            {
               "Check":"DataType",
               "Action":"Reject"
            }
         ]
      },
      {
         "Name":"context_device_type",
         "Type":"VARCHAR(256)",
         "Validations":[
            {
               "Check":"DataType",
               "Action":"Reject"
            }
         ]
      },
      {
         "Name":"context_ip",
         "Type":"VARCHAR(256)",
         "Validations":[
            {
               "Check":"DataType",
               "Action":"Reject"
            }
         ]
      },
      {
         "Name":"context_library_name",
         "Type":"VARCHAR(256)",
         "Validations":[
            {
               "Check":"DataType",
               "Action":"Reject"
            }
         ]
      },
      {
         "Name":"context_library_version",
         "Type":"VARCHAR(256)",
         "Validations":[
            {
               "Check":"DataType",
               "Action":"Reject"
            }
         ]
      },
      {
         "Name":"context_locale",
         "Type":"VARCHAR(256)",
         "Validations":[
            {
               "Check":"DataType",
               "Action":"Reject"
            }
         ]
      },
      {
         "Name":"context_network_bluetooth",
         "Type":"BOOLEAN",
         "Validations":[
            {
               "Check":"DataType",
               "Action":"Reject"
            },
            {
            	"Check":"ValuesConstraint",
	            "Values":"true,false"
            }			
         ]
      },
      {
         "Name":"context_network_carrier",
         "Type":"VARCHAR(256)",
         "Validations":[
            {
               "Check":"DataType",
               "Action":"Reject"
            }
         ]
      },
      {
         "Name":"context_network_wifi",
         "Type":"BOOLEAN",
         "Validations":[
            {
               "Check":"DataType",
               "Action":"Reject"
            },
			{
            	"Check":"ValuesConstraint",
	            "Values":"true,false"
            }
         ]
      },
      {
         "Name":"context_os_name",
         "Type":"VARCHAR(256)",
         "Validations":[
            {
               "Check":"DataType",
               "Action":"Reject"
            }
         ]
      },
      {
         "Name":"context_os_version",
         "Type":"VARCHAR(256)",
         "Validations":[
            {
               "Check":"DataType",
               "Action":"Reject"
            }
         ]
      },
      {
         "Name":"context_screen_height",
         "Type":"BIGINT",
         "Validations":[
            {
               "Check":"DataType",
               "Action":"Reject"
            }
         ]
      },
      {
         "Name":"context_screen_width",
         "Type":"BIGINT",
         "Validations":[
            {
               "Check":"DataType",
               "Action":"Reject"
            }
         ]
      },
      {
         "Name":"event",
         "Type":"VARCHAR(256)",
         "Validations":[
            {
               "Check":"DataType",
               "Action":"Reject"
            }
         ]
      },
      {
         "Name":"event_text",
         "Type":"VARCHAR(256)",
         "Validations":[
            {
               "Check":"DataType",
               "Action":"Reject"
            }
         ]
      },
      {
         "Name":"original_timestamp",
         "Type":"VARCHAR(256)",
         "Validations":[
            {
               "Check":"DataType",
               "Action":"Reject"
            }
         ]
      },
      {
         "Name":"sent_at",
         "Type":"TIMESTAMP",
         "Format":"yyyy-MM-dd HH:mm:ss.SSS",
		 "TimeZone":"UTC",
		 "ConvertToTimeZone":"EST",
         "Validations":[
            {
               "Check":"DataType",
               "Action":"Reject"
            }
         ]
      },
      {
         "Name":"sp_category",
         "Type":"VARCHAR(256)",
         "Validations":[
            {
               "Check":"DataType",
               "Action":"Reject"
            }
         ]
      },
      {
         "Name":"sp_keyword",
         "Type":"VARCHAR(256)",
         "Validations":[
            {
               "Check":"DataType",
               "Action":"Reject"
            }
         ]
      },
      {
         "Name":"timestamp",
         "Type":"TIMESTAMP",
         "Format":"yyyy-MM-dd HH:mm:ss.SSS",
		 "TimeZone":"UTC",
		 "ConvertToTimeZone":"EST",
         "Validations":[
            {
               "Check":"DataType",
               "Action":"Reject"
            }
         ]
      },
      {
         "Name":"user_id",
         "Type":"VARCHAR(256)",
         "Validations":[
            {
               "Check":"DataType",
               "Action":"Reject"
            }
         ]
      },
      {
         "Name":"member_id_legacy",
         "Type":"BIGINT",
         "Validations":[
            {
               "Check":"DataType",
               "Action":"Reject"
            }
         ]
      },
      {
         "Name":"user_id40",
         "Type":"BIGINT",
         "Validations":[
            {
               "Check":"DataType",
               "Action":"Reject"
            }
         ]
      },
      {
         "Name":"uuid_ts",
         "Type":"TIMESTAMP",
         "Format":"yyyy-MM-dd HH:mm:ss.SSS",
		 "TimeZone":"UTC",
		 "ConvertToTimeZone":"EST",
 		 "TimeZone":"UTC",
		 "ConvertToTimeZone":"EST",		 
         "Validations":[
            {
               "Check":"DataType",
               "Action":"Reject"
            }
         ]
      }
  ]
}