{  
   "InputTableName":"inc_t_invoice_item",
   "OutputTableName":"dq_t_invoice_item",
   "SourceDB":"INCOMING_ALWEB_AL_DB",
   "TargetDB":"GOLD_ALWEB_AL_DB",
   "DQHiveTableLocation":"$S3_BUCKET/data/gold/alweb/angieslist/full/daily/dq_t_invoice_item",
   "TableValidation":[  
            {  
               "Check":"Duplicate",
               "keyColumns":"invoice_item_id",
               "Action":"Reject"
            }
         ],
   "Columns":[
   {
         "Name":"invoice_item_id",
         "Type":"INT",
         "Validations":[
            {
               "Check":"Null",
               "Action":"Reject"
            },
            {
               "Check":"DataType",
               "Action":"Reject"
            }
         ]
      },
      {
         "Name":"invoice_id",
         "Type":"INT",
         "Validations":[
            {
               "Check":"Null",
               "Action":"Reject"
            },
            {
               "Check":"DataType",
               "Action":"Reject"
            }
         ]
      },
       {
         "Name":"sku_id",
         "Type":"INT",
         "Validations":[
            {
               "Check":"DataType",
               "Action":"Reject"
            }
         ]
      },
       {
         "Name":"item_type",
         "Type":"VARCHAR(254)",
         "Validations":[
            {
               "Check":"Null",
               "Action":"Reject"
            },
            {
               "Check":"DataType",
               "Action":"Reject"
            }
         ]
      },
       {
         "Name":"kind",
         "Type":"VARCHAR(254)",
         "Validations":[
            {
               "Check":"DataType",
               "Action":"Reject"
            }
         ]
      },
       {
         "Name":"price",
         "Type":"DECIMAL(10,2)",
         "Validations":[
            {
               "Check":"Null",
               "Action":"Reject"
            },
            {
               "Check":"DataType",
               "Action":"Reject"
            }
         ]
      },
       {
         "Name":"quantity",
         "Type":"INT",
         "Validations":[
            {
               "Check":"Null",
               "Action":"Reject"
            },
            {
               "Check":"DataType",
               "Action":"Reject"
            }
         ]
      },
       {
         "Name":"description",
         "Type":"String",
         "Validations":[
            {
               "Check":"Null",
               "Action":"Reject"
            },
            {
               "Check":"DataType",
               "Action":"Reject"
            }
         ]
      },
       {
         "Name":"prepaid_job_sku_item_id",
         "Type":"INT",
         "Validations":[
            {
               "Check":"DataType",
               "Action":"Reject"
            }
         ]
      },
      {
         "Name":"coupon_code",
         "Type":"VARCHAR(45)",
         "Validations":[
            {
               "Check":"Null",
               "Action":"Reject"
            },
            {
               "Check":"DataType",
               "Action":"Reject"
            }
         ]
      },
      {
         "Name":"version",
         "Type":"INT",
         "Validations":[
            {
               "Check":"Null",
               "Action":"Reject"
            },
            {
               "Check":"DataType",
               "Action":"Reject"
            }
         ]
      },      
      {  
         "Name":"create_date",
         "Type":"TIMESTAMP",
		 "Format":"yyyy-MM-dd HH:mm:ss",
		 "TimeZone":"UTC",
		 "ConvertToTimeZone":"EST",
         "Validations":[  
            {  
               "Check":"Null",
               "Action":"Reject"
            },
            {  
               "Check":"DataType",
               "Action":"Reject"
            }
         ]
      },
      {  
         "Name":"create_by",
         "Type":"INT",
         "Validations":[  
            {  
               "Check":"Null",
               "Action":"Reject"
            },
            {  
               "Check":"DataType",
               "Action":"Reject"
            }
         ]
      },
      {  
         "Name":"update_date",
         "Type":"TIMESTAMP",
		 "Format":"yyyy-MM-dd HH:mm:ss",
		 "TimeZone":"UTC",
		 "ConvertToTimeZone":"EST",
         "Validations":[  
            {  
               "Check":"Null",
               "Action":"Reject"
            },
            {  
               "Check":"DataType",
               "Action":"Reject"
            }
         ]
      },
      {  
         "Name":"update_by",
         "Type":"INT",
         "Validations":[  
            {  
               "Check":"Null",
               "Action":"Reject"
            },
            {  
               "Check":"DataType",
               "Action":"Reject"
            }
         ]
      }
    ]
}