{  
   "InputTableName":"inc_t_category",
   "OutputTableName":"dq_t_category",
   "SourceDB":"INCOMING_ALWEB_AL_DB",
   "TargetDB":"GOLD_ALWEB_AL_DB",
   "DQHiveTableLocation":"$S3_BUCKET/data/gold/alweb/angieslist/full/daily/dq_t_category",
   "TableValidation":[  
      {  
         "Check":"Duplicate",
         "keyColumns":"category_id",
         "Action":"Reject"
      }
   ],
   "Columns":[  
      {  
         "Name":"category_id",
         "Type":"INT",
         "Validations":[  
            {  
               "Check":"Null",
               "Action":"Reject"
            },
            {  
               "Check":"DataType",
               "Action":"Reject"
            }
         ]
      },
		{  
         "Name":"name",
		 "Type":"varchar(254)",
         "Validations":[  
            {  
               "Check":"Null",
               "Action":"Reject"
            },
            {  
               "Check":"DataType",
               "Action":"Reject"
            }
            
         ]
      },
      {  
         "Name":"status",
		 "Type":"varchar(254)",
         "Validations":[  
            {  
               "Check":"Null",
               "Action":"Reject"
            },
            {  
               "Check":"DataType",
               "Action":"Reject"
            }
            
         ]
      },
      {  
         "Name":"create_date",
         "Type":"TIMESTAMP",
         "Format":"yyyy-MM-dd HH:mm:ss.SSS",
         "TimeZone":"UTC",
		 "ConvertToTimeZone":"EST",
         "Validations":[  
            {  
               "Check":"Null",
               "Action":"Reject"
            },
            {  
               "Check":"DataType",
               "Action":"Reject"
            }
         ]
      },
      {  
         "Name":"create_by",
         "Type":"INT",
         "Validations":[  
            {  
               "Check":"Null",
               "Action":"Reject"
            },
            {  
               "Check":"DataType",
               "Action":"Reject"
            }
         ]
      },
      {  
         "Name":"update_date",
         "Type":"TIMESTAMP",
         "Format":"yyyy-MM-dd HH:mm:ss.SSS",
         "TimeZone":"UTC",
		 "ConvertToTimeZone":"EST",
         "Validations":[  
            {  
               "Check":"Null",
               "Action":"Reject"
            },
            {  
               "Check":"DataType",
               "Action":"Reject"
            }
         ]
      },
      {  
         "Name":"update_by",
         "Type":"INT",
         "Validations":[  
            {  
               "Check":"Null",
               "Action":"Reject"
            },
            {  
               "Check":"DataType",
               "Action":"Reject"
            }
         ]
      }
     ]
}